{"bundle_digest":"ab121877d52e45639a9058d3e0c3106b30aa09cd253920ecfdb7eecc7c6730ec","entries":[{"candidate_id":"EXEC:RESP-1:CA-1-10:INCORRECT","ica_id":"RESP-1:CA-1-10:INCORRECT:1","ica_slot_id":"RESP-1:CA-1-10:INCORRECT","projection":{"content_sha256":"e857cd1e963376eed329a8806c08e9029c47d43bb90938ede78e8ab47ac13cdf","path":"scenarios/canonical/SCN-001.projection.json","schema_version":"stpa-execution-projection-v3","semantic_digest":"c3dd55e9235ceb371e770241c25bcd6be6f966be7c87f1ffb8d02b2dba61cbf7"},"scenario":{"content_sha256":"41fef91b9cc58221a7e552e540b204c44c05a4711df1a2acfbce54e6c0cadce3","path":"scenarios/SCN-001.scenario.json"},"scenario_id":"SCN-001","validation":{"status":"valid","validator_version":"stpa-execution-projection-v3"}}],"producer":{"name":"asago-scenario-generator","version":"0.1.0"},"run_id":"synthesis-20260913T224432.736291Z","schema_version":"stpa-execution-bundle-v2"}