{"bundle_digest":"e8313d371d1776d87503c6e724f456b35fc0a74c871bdc9845620e3eb4b0738e","entries":[{"candidate_id":"EXEC:RESP-1:CA-1-1:NOT_PROVIDED","ica_id":"RESP-1:CA-1-1:NOT_PROVIDED:1","ica_slot_id":"RESP-1:CA-1-1:NOT_PROVIDED","projection":{"content_sha256":"f07290e8b83e2c701df77ace137176223412a920768bd5327bed4696e2c77e66","path":"scenarios/canonical/SCN-001.projection.json","schema_version":"stpa-execution-projection-v3","semantic_digest":"6daf7ef7c745a6e3a071216e5bdfbdfee9014a18790cba9658a880ce8af6e828"},"scenario":{"content_sha256":"8012457f3c4c89ce92686e58c5e8c511cc32baef34b1979e66468bd62d701921","path":"scenarios/SCN-001.scenario.json"},"scenario_id":"SCN-001","validation":{"status":"valid","validator_version":"stpa-execution-projection-v3"}}],"producer":{"name":"asago-scenario-generator","version":"fixture"},"run_id":"run-1","schema_version":"stpa-execution-bundle-v2"}