{"bundle_digest":"8916726b56d1f97a1c2efbc006b7c2191247a6491cf9f83a5d0d682489c07f52","entries":[{"candidate_id":"EXEC:RESP-1:CA-1-5:WRONG_TIMING","ica_id":"RESP-1:CA-1-5:WRONG_TIMING:1","ica_slot_id":"RESP-1:CA-1-5:WRONG_TIMING","projection":{"content_sha256":"1be1c598305abc606086fc69fc7b0c1edf5ae05b709f9d92e87ea6172dd78557","path":"scenarios/canonical/SCN-007.projection.json","schema_version":"stpa-execution-projection-v3","semantic_digest":"fd2ed3b3c5555546306a07e4bc159b108caff480f0d2ee37efcefea28b70bc35"},"scenario":{"content_sha256":"0890ecc52b8a01576e8c3197f3439fe6fd19187b19bdca799cc48de94cd3d11a","path":"scenarios/SCN-007.scenario.json"},"scenario_id":"SCN-007","validation":{"status":"valid","validator_version":"stpa-execution-projection-v3"}}],"producer":{"name":"asago-scenario-generator","version":"0.1.0"},"run_id":"synthesis-20260914T070828.799959Z","schema_version":"stpa-execution-bundle-v2"}